{
  "computes": [],
  "effects": [
    {
      "amount": {
        "kind": "ref",
        "value": "quantity"
      },
      "currency": {
        "kind": "ref",
        "value": "unit"
      },
      "idempotencyKey": {
        "kind": "ref",
        "value": "request_id"
      },
      "kind": "debit",
      "ledger": "synthetic.left",
      "name": "decrease",
      "owner": "left",
      "participant": "LeftActor",
      "party": {
        "kind": "ref",
        "value": "actor_id"
      }
    },
    {
      "amount": {
        "kind": "ref",
        "value": "quantity"
      },
      "currency": {
        "kind": "ref",
        "value": "unit"
      },
      "idempotencyKey": {
        "kind": "ref",
        "value": "request_id"
      },
      "kind": "credit",
      "ledger": "synthetic.right",
      "name": "increase",
      "owner": "right",
      "participant": "RightActor",
      "party": {
        "kind": "ref",
        "value": "actor_id"
      }
    }
  ],
  "identity": {
    "capabilityHash": "7944e6246946b1df9c04dc2bf2243d50d7d5dc8af091a96c91f872b041735f09",
    "specHash": "d98c8e7264f6084fa8d61c94392dd4990f8ec72a84d0d7e97fc3f89543a2199d"
  },
  "inputs": [
    {
      "category": "string",
      "name": "request_id",
      "type": "string"
    },
    {
      "category": "party",
      "name": "actor_id",
      "type": "party"
    },
    {
      "category": "money",
      "name": "quantity",
      "type": "money"
    },
    {
      "category": "currency",
      "name": "unit",
      "type": "currency"
    }
  ],
  "invariants": [
    {
      "kind": "balanced"
    }
  ],
  "kind": "neutrino.capability-spec",
  "lifecycle": {
    "initialState": "INITIAL",
    "instanceKey": {
      "fields": [
        "request_id"
      ]
    },
    "states": [
      {
        "name": "INITIAL",
        "terminal": false
      },
      {
        "name": "NEW",
        "terminal": false
      },
      {
        "name": "NEGOTIATED",
        "terminal": false
      },
      {
        "name": "PROPOSED",
        "terminal": false
      },
      {
        "name": "COMMITTED",
        "terminal": false
      },
      {
        "name": "REJECTED",
        "terminal": true,
        "terminalKind": "aborted"
      },
      {
        "name": "COMPENSATED",
        "terminal": false
      },
      {
        "name": "CLOSED",
        "terminal": true,
        "terminalKind": "success"
      }
    ],
    "terminalStates": {
      "aborted": "REJECTED",
      "contested": null,
      "success": "CLOSED"
    },
    "transitions": [
      {
        "effects": [],
        "evidence": null,
        "from": "INITIAL",
        "guards": [],
        "idempotency": "reject",
        "name": "OPEN",
        "to": "NEW"
      },
      {
        "effects": [],
        "evidence": null,
        "from": "NEW",
        "guards": [],
        "idempotency": "reject",
        "name": "NEGOTIATE",
        "to": "NEGOTIATED"
      },
      {
        "effects": [],
        "evidence": null,
        "from": "NEGOTIATED",
        "guards": [],
        "idempotency": "reject",
        "name": "PROPOSE",
        "to": "PROPOSED"
      },
      {
        "effects": [
          "post"
        ],
        "evidence": null,
        "from": "PROPOSED",
        "guards": [],
        "idempotency": "reject",
        "name": "COMMIT",
        "to": "COMMITTED"
      },
      {
        "effects": [],
        "evidence": null,
        "from": "PROPOSED",
        "guards": [],
        "idempotency": "reject",
        "name": "REJECT",
        "to": "REJECTED"
      },
      {
        "effects": [
          "compensate"
        ],
        "evidence": null,
        "from": "COMMITTED",
        "guards": [],
        "idempotency": "reject",
        "name": "COMPENSATE",
        "to": "COMPENSATED"
      },
      {
        "effects": [],
        "evidence": null,
        "from": "COMMITTED",
        "guards": [],
        "idempotency": "reject",
        "name": "CLOSE",
        "to": "CLOSED"
      },
      {
        "effects": [],
        "evidence": null,
        "from": "COMPENSATED",
        "guards": [],
        "idempotency": "reject",
        "name": "CLOSE",
        "to": "CLOSED"
      }
    ]
  },
  "participants": [
    {
      "bindMinAssurance": "",
      "bindRuntimes": [],
      "binding": "fixed",
      "capabilities": [],
      "name": "LeftActor",
      "org": "alpha",
      "role": "left"
    },
    {
      "bindMinAssurance": "",
      "bindRuntimes": [],
      "binding": "fixed",
      "capabilities": [],
      "name": "RightActor",
      "org": "beta",
      "role": "right"
    }
  ],
  "procedure": "core_security_fixture",
  "schemaVersion": 1,
  "sourceMap": [
    {
      "construct": "input request_id",
      "source": {
        "column": 1,
        "line": 17
      },
      "specPath": "inputs[0]"
    },
    {
      "construct": "input actor_id",
      "source": {
        "column": 1,
        "line": 18
      },
      "specPath": "inputs[1]"
    },
    {
      "construct": "input quantity",
      "source": {
        "column": 1,
        "line": 19
      },
      "specPath": "inputs[2]"
    },
    {
      "construct": "input unit",
      "source": {
        "column": 1,
        "line": 20
      },
      "specPath": "inputs[3]"
    },
    {
      "construct": "debit decrease",
      "source": {
        "column": 1,
        "line": 22
      },
      "specPath": "effects[0]"
    },
    {
      "construct": "credit increase",
      "source": {
        "column": 1,
        "line": 32
      },
      "specPath": "effects[1]"
    },
    {
      "construct": "participant LeftActor",
      "source": {
        "column": 1,
        "line": 4
      },
      "specPath": "participants[0]"
    },
    {
      "construct": "participant RightActor",
      "source": {
        "column": 1,
        "line": 8
      },
      "specPath": "participants[1]"
    },
    {
      "construct": "allow alpha with beta",
      "source": {
        "column": 1,
        "line": 12
      },
      "specPath": "topology.allowedOrgPairs[0]"
    },
    {
      "construct": "assert balanced",
      "source": {
        "column": 1,
        "line": 42
      },
      "specPath": "invariants[0]"
    }
  ],
  "specVersion": "1.0.0",
  "targetRequirements": {
    "evidenceStyle": "single_hash",
    "requirements": [
      {
        "fallback": null,
        "feature": "value_category:string",
        "primitive": "input request_id",
        "requirement": "required",
        "source": {
          "column": 1,
          "line": 17
        }
      },
      {
        "fallback": null,
        "feature": "value_category:party",
        "primitive": "input actor_id",
        "requirement": "required",
        "source": {
          "column": 1,
          "line": 18
        }
      },
      {
        "fallback": null,
        "feature": "value_category:money",
        "primitive": "input quantity",
        "requirement": "required",
        "source": {
          "column": 1,
          "line": 19
        }
      },
      {
        "fallback": null,
        "feature": "value_category:currency",
        "primitive": "input unit",
        "requirement": "required",
        "source": {
          "column": 1,
          "line": 20
        }
      },
      {
        "fallback": null,
        "feature": "effect:debit",
        "primitive": "debit decrease",
        "requirement": "required",
        "source": {
          "column": 1,
          "line": 22
        }
      },
      {
        "fallback": null,
        "feature": "effect:credit",
        "primitive": "credit increase",
        "requirement": "required",
        "source": {
          "column": 1,
          "line": 32
        }
      },
      {
        "fallback": null,
        "feature": "invariant:balanced",
        "primitive": "assert balanced",
        "requirement": "required",
        "source": {
          "column": 1,
          "line": 42
        }
      },
      {
        "fallback": null,
        "feature": "topology:participants",
        "primitive": "participant LeftActor",
        "requirement": "required",
        "source": {
          "column": 1,
          "line": 4
        }
      },
      {
        "fallback": null,
        "feature": "topology:org_coordination",
        "primitive": "allow alpha with beta",
        "requirement": "required",
        "source": {
          "column": 1,
          "line": 12
        }
      }
    ],
    "unsupportedConstructs": []
  },
  "topology": {
    "allowedOrgPairs": [
      {
        "orgA": "alpha",
        "orgB": "beta",
        "roleA": "wrong",
        "roleB": "right"
      }
    ]
  },
  "trigger": null
}
